{
  "schema_version": "0.1",
  "evidence_type": "package_install",
  "gate_name": "PackageInstallGate",
  "scenario_id": "clean-pack-scaffold-single-user",
  "git_ref": "9198820",
  "package_name": "create-workframe",
  "package_version": "0.1.11",
  "packed_artifact_digest": "sha512-EXAMPLE-REDACTED",
  "target_mode": "single_user_local",
  "decision": "needs_user_action",
  "decision_reason": "Example fixture only — runner WF-021 not wired yet; schema contract reference.",
  "timestamp": "2026-07-05T06:45:00Z",
  "commands_redacted": [
    "pnpm build:web",
    "node packages/create-workframe/scripts/bundle-workframe-ui.mjs --skip-build",
    "npm pack packages/create-workframe",
    "npm install -g ./create-workframe-0.1.11.tgz",
    "create-workframe ExampleTarget"
  ],
  "step_assertions": [
    { "id": "version_agreement", "status": "asserted", "note": "verify-version-agreement.mjs" },
    { "id": "pack_created", "status": "not_asserted" },
    { "id": "clean_target_created", "status": "not_asserted" },
    { "id": "required_files_present", "status": "not_asserted" },
    { "id": "manifest_version_match", "status": "not_asserted" },
    { "id": "ui_bundle_identity", "status": "not_asserted" }
  ],
  "negative_cases": [
    { "id": "non_empty_target", "decision": "deny", "mutation_observed": false },
    { "id": "missing_docker", "decision": "needs_user_action", "mutation_observed": false }
  ],
  "artifact_paths_redacted": ["/tmp/wf-pack-example/"]
}
